{
    "id": "urn:ngsi-ld:AgriFertilize:1",
    "type": "AgriFertilize",
    "dateCreated": "30-05-2024 09:14:44",
    "dateModified": "30-05-2024 09:14:44",
    "name": "",
    "subtype": {
        "type": "TypeFertilize",
        "id": 1339,
        "code": "F0002478/2025",
        "name": "Abono Organico Npk (Ca) 1,5-1-2 (2) Mezcla De Origen Animal Y Vegetal Sirlepur",
        "mmcm": [{
            "type": "CM",
            "id": 10000,
            "subtype": {
                "type": "TCM",
                "id": 1,
                "subtype": {
                    "type": "SCM",
                    "id": 1,
                    "name": "Macronutriente principal"
                },
                "code": 1,
                "name": "Nitrógeno total",
                "symbol": "% N total"
            },
            "value": 1.5
        }, {
            "type": "CM",
            "id": 10001,
            "subtype": {
                "type": "TCM",
                "id": 6,
                "subtype": {
                    "type": "SCM",
                    "id": 1,
                    "name": "Macronutriente principal"
                },
                "code": 6,
                "name": "Óxido de fósforo total",
                "symbol": "% P2O5 total"
            },
            "value": 1
        }, {
            "type": "CM",
            "id": 10002,
            "subtype": {
                "type": "TCM",
                "id": 9,
                "subtype": {
                    "type": "SCM",
                    "id": 1,
                    "name": "Macronutriente principal"
                },
                "code": 9,
                "name": "Óxido de potasio",
                "symbol": "% K2O total"
            },
            "value": 2
        }],
        "macm": [],
        "hecm": [],
        "micm": [],
        "accm": [],
        "aacm": [],
        "otcm": [],
        "comp": {
            "type": "Company",
            "id": 269,
            "name": "Organicos Pedrin, S.l",
            "nif": ""
        },
        "manure": null,
        "material": {
            "type": "TMF",
            "id": 15,
            "name": "Productos fertilizantes: abonos orgánicos"
        },
        "matdet": null,
        "provider": "",
        "nif": "",
        "check": 0,
        "metadata": [{
            "type": "Create",
            "user": {
                "type": "UserMetadata",
                "id": "1",
                "loginname": "sistema",
                "email": "",
                "name": "Sistema",
                "surname": "",
                "nif": ""
            },
            "date": "09-02-2024 15:48:46"
        }],
        "reviewed": "1"
    },
    "inidate": "30-05-2024 09:14:44",
    "enddate": "",
    "dose": 10,
    "measure": {
        "type": "Measure",
        "id": "501",
        "subtype": {
            "type": "TypeMeasure",
            "id": "6",
            "name": "Fertilizante"
        },
        "code": 17,
        "name": "Kilogramo por hectárea",
        "symbol": "kg/ha",
        "prior": "1",
        "detail": ""
    },
    "soup": 1000,
    "msoup": {
        "type": "Measure",
        "id": "514",
        "subtype": {
            "type": "TypeMeasure",
            "id": "6",
            "name": "Fertilizante"
        },
        "code": 4,
        "name": "Litro",
        "symbol": "l",
        "prior": "3",
        "detail": ""
    },
    "r10": "",
    "mud": 0,
    "bill": "",
    "plan": null,
    "taf": {
        "type": "TAF",
        "id": "1",
        "name": "Abonado de fondo"
    },
    "maf": {
        "type": "MAF",
        "id": "1",
        "name": "Esparcido general"
    },
    "tmi": {
        "type": "TMI",
        "id": "1",
        "name": "Sin especificar",
        "acronym": ""
    },
    "tgp": [],
    "machine": [],
    "detail": "",
    "idcp": ["13", "14", "15", "16", "17", "18", "19", "20", "21", "22", "23", "24", "25", "26", "27", "28", "29", "30", "31", "32", "33", "34", "35", "36", "37", "38", "39"]
}
